[
  {
    "id": "paper-001",
    "system": "Human cardiac RR (supine 5-min)",
    "domain": "cardiac",
    "class": "A",
    "symmetry": "SO(2)",
    "n": 4,
    "phi_G": 6.283185307179586,
    "omega_geo": 0.15915494309189535,
    "cv_pred": 0.07957747154594767,
    "cv_obs": 0.054,
    "ratio": 0.6785840131753953,
    "verdict": "MATCH",
    "physical_justification": "Continuous cardiac limit cycle; phase wraps continuously through systole/diastole/recovery \u2014 SO(2) substrate.",
    "class_justification": "Autonomous oscillator under intrinsic vagal/sympathetic stochasticity; no strong external entrainment in supine rest.",
    "data_extraction": "as cited",
    "reference": "Nunan 2010 BJSM 44:202",
    "notes": "",
    "provenance": "paper-appendix-A"
  },
  {
    "id": "paper-002",
    "system": "Human cardiac RR (24-hr Holter)",
    "domain": "cardiac",
    "class": "C",
    "symmetry": "Z2",
    "n": 2,
    "phi_G": 3.141592653589793,
    "omega_geo": 0.3183098861837907,
    "cv_pred": 0.15915494309189535,
    "cv_obs": 0.166,
    "ratio": 1.0430087609918113,
    "verdict": "MATCH",
    "physical_justification": "On 24-hr scale the cycle reduces to active/rest binary regimes \u2014 Z\u2082 envelope dominates.",
    "class_justification": "Volitional and circadian drivers inflate effective \u03a9; Class C noise-dominated.",
    "data_extraction": "as cited",
    "reference": "Task Force 1996 Eur Heart J 17:354",
    "notes": "",
    "provenance": "paper-appendix-A"
  },
  {
    "id": "paper-003",
    "system": "Human cardiac RR (paced breathing)",
    "domain": "cardiac",
    "class": "A",
    "symmetry": "SO(2)",
    "n": 4,
    "phi_G": 6.283185307179586,
    "omega_geo": 0.15915494309189535,
    "cv_pred": 0.07957747154594767,
    "cv_obs": 0.06,
    "ratio": 0.7539822368615503,
    "verdict": "MATCH",
    "physical_justification": "Continuous cardiac limit cycle entrained by paced respiration but still SO(2)-structured.",
    "class_justification": "Light entrainment leaves \u03a9 near intrinsic value; Class A.",
    "data_extraction": "as cited",
    "reference": "Nunan 2010 BJSM 44:202",
    "notes": "",
    "provenance": "paper-appendix-A"
  },
  {
    "id": "paper-004",
    "system": "Human respiratory rate (awake)",
    "domain": "respiratory",
    "class": "C",
    "symmetry": "Z2",
    "n": 2,
    "phi_G": 3.141592653589793,
    "omega_geo": 0.3183098861837907,
    "cv_pred": 0.15915494309189535,
    "cv_obs": 0.208,
    "ratio": 1.306902543893354,
    "verdict": "ELEVATED",
    "physical_justification": "Inspiration / expiration are two qualitatively distinguishable states \u2014 Z\u2082.",
    "class_justification": "Awake cortical modulation inflates \u03a9 above thermodynamic baseline.",
    "data_extraction": "as cited",
    "reference": "Tobin 1988 J Appl Physiol 65:309",
    "notes": "",
    "provenance": "paper-appendix-A"
  },
  {
    "id": "paper-005",
    "system": "Human respiratory rate (NREM sleep)",
    "domain": "respiratory",
    "class": "A",
    "symmetry": "SO(2)",
    "n": 4,
    "phi_G": 6.283185307179586,
    "omega_geo": 0.15915494309189535,
    "cv_pred": 0.07957747154594767,
    "cv_obs": 0.055,
    "ratio": 0.6911503837897545,
    "verdict": "MATCH",
    "physical_justification": "In NREM the respiration is a smooth limit cycle without volitional modulation \u2014 SO(2).",
    "class_justification": "Cortical modulation removed; \u03a9 at intrinsic value; Class A.",
    "data_extraction": "as cited",
    "reference": "Stone 2021 npj Digit Med",
    "notes": "",
    "provenance": "paper-appendix-A"
  },
  {
    "id": "paper-006",
    "system": "Human tidal volume variability",
    "domain": "respiratory",
    "class": "C",
    "symmetry": "Z2",
    "n": 2,
    "phi_G": 3.141592653589793,
    "omega_geo": 0.3183098861837907,
    "cv_pred": 0.15915494309189535,
    "cv_obs": 0.33,
    "ratio": 2.0734511513692637,
    "verdict": "ELEVATED",
    "physical_justification": "Tidal volume sets inspiration/expiration amplitude \u2014 Z\u2082 binary boundary in volume space.",
    "class_justification": "Awake volitional control + sigh injection inflate \u03a9.",
    "data_extraction": "as cited",
    "reference": "Tobin 1988 J Appl Physiol 65:309",
    "notes": "",
    "provenance": "paper-appendix-A"
  },
  {
    "id": "paper-007",
    "system": "Inspiratory time variability",
    "domain": "respiratory",
    "class": "C",
    "symmetry": "Z2",
    "n": 2,
    "phi_G": 3.141592653589793,
    "omega_geo": 0.3183098861837907,
    "cv_pred": 0.15915494309189535,
    "cv_obs": 0.16,
    "ratio": 1.0053096491487339,
    "verdict": "MATCH",
    "physical_justification": "Inspiration is one of the two Z\u2082 states.",
    "class_justification": "Volitional class but happens to land at thermodynamic baseline.",
    "data_extraction": "as cited",
    "reference": "Tobin 1988 J Appl Physiol 65:309",
    "notes": "",
    "provenance": "paper-appendix-A"
  },
  {
    "id": "paper-008",
    "system": "Expiratory time variability",
    "domain": "respiratory",
    "class": "C",
    "symmetry": "Z2",
    "n": 2,
    "phi_G": 3.141592653589793,
    "omega_geo": 0.3183098861837907,
    "cv_pred": 0.15915494309189535,
    "cv_obs": 0.2,
    "ratio": 1.2566370614359172,
    "verdict": "MATCH",
    "physical_justification": "Expiration is the other Z\u2082 state.",
    "class_justification": "Volitional class but lands at thermodynamic baseline.",
    "data_extraction": "as cited",
    "reference": "Tobin 1988 J Appl Physiol 65:309",
    "notes": "",
    "provenance": "paper-appendix-A"
  },
  {
    "id": "paper-009",
    "system": "Purkinje cell simple spike ISI",
    "domain": "neural",
    "class": "A",
    "symmetry": "SO(2)",
    "n": 4,
    "phi_G": 6.283185307179586,
    "omega_geo": 0.15915494309189535,
    "cv_pred": 0.07957747154594767,
    "cv_obs": 0.1,
    "ratio": 1.2566370614359172,
    "verdict": "MATCH",
    "physical_justification": "Pacemaker-like cerebellar limit cycle \u2014 continuous SO(2) phase.",
    "class_justification": "Autonomous under intrinsic ion-channel noise; Class A.",
    "data_extraction": "as cited",
    "reference": "Shin 2007 J Neurophysiol",
    "notes": "",
    "provenance": "paper-appendix-A"
  },
  {
    "id": "paper-010",
    "system": "Motor unit firing ISI",
    "domain": "neural",
    "class": "A",
    "symmetry": "SO(2)",
    "n": 4,
    "phi_G": 6.283185307179586,
    "omega_geo": 0.15915494309189535,
    "cv_pred": 0.07957747154594767,
    "cv_obs": 0.1,
    "ratio": 1.2566370614359172,
    "verdict": "MATCH",
    "physical_justification": "Motoneuron firing in a tonic regime is a smooth limit cycle.",
    "class_justification": "Tonic-firing autonomous oscillator; Class A.",
    "data_extraction": "as cited",
    "reference": "Clamann 1969 J Neurophysiol",
    "notes": "",
    "provenance": "paper-appendix-A"
  },
  {
    "id": "paper-011",
    "system": "Hippocampal theta cycle (rat)",
    "domain": "neural",
    "class": "A",
    "symmetry": "SO(2)",
    "n": 4,
    "phi_G": 6.283185307179586,
    "omega_geo": 0.15915494309189535,
    "cv_pred": 0.07957747154594767,
    "cv_obs": 0.09,
    "ratio": 1.1309733552923253,
    "verdict": "MATCH",
    "physical_justification": "Theta is a continuous network limit cycle (4-12 Hz phase progression).",
    "class_justification": "Autonomous network oscillation; Class A.",
    "data_extraction": "as cited",
    "reference": "Buzsaki 2002 Hippocampus 12:100",
    "notes": "",
    "provenance": "paper-appendix-A"
  },
  {
    "id": "paper-012",
    "system": "Sleep spindle interval",
    "domain": "neural",
    "class": "A",
    "symmetry": "Z2",
    "n": 2,
    "phi_G": 3.141592653589793,
    "omega_geo": 0.3183098861837907,
    "cv_pred": 0.15915494309189535,
    "cv_obs": 0.2,
    "ratio": 1.2566370614359172,
    "verdict": "MATCH",
    "physical_justification": "Spindles are bursts (active) separated by quiescence (inactive) \u2014 Z\u2082.",
    "class_justification": "Autonomous thalamocortical oscillator under stochastic recruitment; Class A.",
    "data_extraction": "as cited",
    "reference": "Andrillon 2011 J Neurosci",
    "notes": "",
    "provenance": "paper-appendix-A"
  },
  {
    "id": "paper-013",
    "system": "Simple reaction time",
    "domain": "behavioural",
    "class": "A",
    "symmetry": "Z2",
    "n": 2,
    "phi_G": 3.141592653589793,
    "omega_geo": 0.3183098861837907,
    "cv_pred": 0.15915494309189535,
    "cv_obs": 0.175,
    "ratio": 1.0995574287564276,
    "verdict": "MATCH",
    "physical_justification": "RT is a stop/go binary decision crossing \u2014 Z\u2082.",
    "class_justification": "Autonomous accumulator-to-threshold; Class A.",
    "data_extraction": "as cited",
    "reference": "Dykiert 2012 PLoS ONE meta",
    "notes": "",
    "provenance": "paper-appendix-A"
  },
  {
    "id": "paper-014",
    "system": "Choice reaction time",
    "domain": "behavioural",
    "class": "A",
    "symmetry": "Z2",
    "n": 2,
    "phi_G": 3.141592653589793,
    "omega_geo": 0.3183098861837907,
    "cv_pred": 0.15915494309189535,
    "cv_obs": 0.2,
    "ratio": 1.2566370614359172,
    "verdict": "MATCH",
    "physical_justification": "Two-alternative decision crossing \u2014 Z\u2082.",
    "class_justification": "Autonomous diffusion-to-bound; Class A.",
    "data_extraction": "as cited",
    "reference": "Dykiert 2012 PLoS ONE meta",
    "notes": "",
    "provenance": "paper-appendix-A"
  },
  {
    "id": "paper-015",
    "system": "Saccade latency (prosaccade)",
    "domain": "behavioural",
    "class": "A",
    "symmetry": "Z2",
    "n": 2,
    "phi_G": 3.141592653589793,
    "omega_geo": 0.3183098861837907,
    "cv_pred": 0.15915494309189535,
    "cv_obs": 0.2,
    "ratio": 1.2566370614359172,
    "verdict": "MATCH",
    "physical_justification": "Latency to a binary fixate/saccade decision \u2014 Z\u2082.",